{
  "$schema": "https://json-schema.org/draft/2020-12/schema",
  "$id": "https://homelab.invalid/schemas/vulnerability-quiz-template-v1.json",
  "title": "Homelab Vulnerability Quiz Template",
  "type": "object",
  "additionalProperties": false,
  "required": [
    "schema_version",
    "template_id",
    "title",
    "vulnerability_class",
    "modes",
    "synthetic_data_only",
    "success_evidence",
    "root_cause",
    "mitigation",
    "juice_shop_reference",
    "safety"
  ],
  "properties": {
    "schema_version": { "const": "1.0.0" },
    "template_id": { "type": "string", "pattern": "^[a-z0-9-]+$" },
    "title": { "type": "string", "minLength": 1 },
    "vulnerability_class": {
      "enum": ["idor", "sql_injection", "stored_xss"]
    },
    "modes": {
      "type": "array",
      "const": ["vulnerable", "fixed"]
    },
    "synthetic_data_only": { "const": true },
    "success_evidence": { "type": "string", "minLength": 1 },
    "root_cause": { "type": "string", "minLength": 1 },
    "mitigation": { "type": "string", "minLength": 1 },
    "juice_shop_reference": {
      "type": "object",
      "additionalProperties": false,
      "required": ["category", "lesson"],
      "properties": {
        "category": { "type": "string", "minLength": 1 },
        "lesson": { "type": "string", "minLength": 1 }
      }
    },
    "safety": {
      "type": "object",
      "additionalProperties": false,
      "required": [
        "allows_command_execution",
        "allows_file_upload",
        "requires_outbound_network",
        "uses_production_data"
      ],
      "properties": {
        "allows_command_execution": { "const": false },
        "allows_file_upload": { "const": false },
        "requires_outbound_network": { "const": false },
        "uses_production_data": { "const": false }
      }
    }
  }
}
