{
  "schema_version": "1.0.0",
  "template_id": "expense-idor",
  "title": "Acme Expense Portal",
  "vulnerability_class": "idor",
  "modes": ["vulnerable", "fixed"],
  "synthetic_data_only": true,
  "success_evidence": "An authenticated employee retrieves another synthetic employee's expense by changing the numeric object identifier.",
  "root_cause": "The vulnerable lookup authenticates the requester but does not verify that the requested expense belongs to that user.",
  "mitigation": "Apply object-level authorization after lookup and return the same not-found response for absent and unauthorized records.",
  "juice_shop_reference": {
    "category": "Broken Access Control",
    "lesson": "Transfer the ownership-check reasoning from Juice Shop access-control challenges to an unfamiliar API."
  },
  "safety": {
    "allows_command_execution": false,
    "allows_file_upload": false,
    "requires_outbound_network": false,
    "uses_production_data": false
  }
}
