{
  "schema_version": "1.0.0",
  "template_id": "trailhead-reviews-stored-xss",
  "title": "Trailhead Field Notes",
  "vulnerability_class": "stored_xss",
  "modes": ["vulnerable", "fixed"],
  "synthetic_data_only": true,
  "success_evidence": "Markup saved in a synthetic field note is later emitted unencoded on the shared reviews page.",
  "root_cause": "The lesson variant treats stored user content as trusted HTML during rendering.",
  "mitigation": "Encode untrusted content for the HTML context and retain a restrictive content security policy.",
  "juice_shop_reference": {"category": "XSS", "lesson": "Transfer stored-XSS source-to-storage-to-sink reasoning to field notes."},
  "safety": {"allows_command_execution": false, "allows_file_upload": false, "requires_outbound_network": false, "uses_production_data": false}
}
